Verzió;Jövedéki engedélyes adószáma (8);Jövedéki engedélyes engedélyszáma (13);Vevõ vagy címzett neve (70);Vevõ vagy címzett adószáma (20);"Dohánygyártmány esetén a jövedéki kiskereskedõ mûködési
engedélyszáma, nyilvántartásba vételi száma vagy dohány
kiskereskedelmi engedélyszáma (20)";Vevõ vagy címzett irányítószám (7);Vevõ vagy címzett település (20);Vevõ vagy címzett utca és házszám (30);Forgalom típusa (1);"Szállítólevél, EKO vagy egyéb 
a kitárolásról szóló bizonylat száma (20)";"Szállítólevél, EKO vagy egyéb 
a kitárolásról szóló bizonylat kelte (ÉÉÉÉHHNN) ";Kiszállítás idõpontja (ÉÉÉÉHHNN)
13;AAAAAAAA;BBBBBBBBBBBBB;Vevõ Sándor;1.23456789012346E+019;;11111;Pornóapáti;Asd utca 10. 55;1;ASDASD123123;19991212;20110101
